"slug","title","description","url","tags","category","author","source"
"lara-mcp","Lara Translate MCP Server","A Model Context Protocol (MCP) Server for [Lara Translate](https://laratranslate.com/translate) API, enabling powerful translation capabilities with support for language detection, context-aware translations and translation memories.","https://github.com/translated/lara-mcp","translation;MCP;Model Context Protocol;language detection;translation memories;multilingual;API","Productivity","{'name': 'translated'}","Local Servers"
"lightdash","Lightdash","Interact with [Lightdash](https://www.lightdash.com/), a BI tool.","https://github.com/syucream/lightdash-mcp-server","Lightdash;AI","Analytics","{'name': 'syucream'}","Local Servers"
"line-bot","LINE Bot MCP Server","1. **push_text_message**","https://github.com/line/line-bot-mcp-server","LINE;bot;messaging;MCP;Model Context Protocol;AI Agent;LINE Messaging API","Messaging","{'name': 'line'}","Local Servers"
"linear","Linear","Allows LLM to interact with Linear's API for project management, including searching, creating, and updating issues.","https://github.com/jerhadf/linear-mcp-server","linear;issue tracking;LLM","Productivity","{'name': 'jerhadf'}","Local Servers"
"lingo-dev","Lingo.dev MCP Server","The [Model Context Protocol](https://modelcontextprotocol.io/introduction) (MCP) is a standard for connecting Large Language Models (LLMs) to external services. This guide will walk you through how to connect AI tools to Lingo.dev using MCP.","https://github.com/lingodotdev/lingo.dev","translation;localization;mcp","Dev Tools","{'name': 'lingodotdev'}","Local Servers"
"llamacloud","LlamaCloud","Integrate the data stored in a managed index on [LlamaCloud](https://cloud.llamaindex.ai/)","https://github.com/run-llama/mcp-server-llamacloud","LlamaCloud;TypeScript","Knowledge Base","{'name': 'run-llama'}","Local Servers"
"llm-context","LLM Context","Provides a repo-packing MCP tool with configurable profiles that specify file inclusion/exclusion patterns and optional prompts.","https://github.com/cyberchitta/llm-context.py","LLM;Context Injection;Development;ChatGPT;Productivity","Dev Tools","{'name': 'cyberchitta'}","Local Servers"
"llmpulse-mcp","LLM Pulse MCP Server","Exposes LLM Pulse brand visibility, citations, sentiment, share of voice, tracked prompts, recommendations, and AI traffic analytics through MCP.","https://github.com/LLM-Pulse/llmpulse-mcp","analytics;ai-visibility;brand-monitoring;citations;sentiment;share-of-voice;streamable-http","data","{'name': 'LLM Pulse'}","Local Servers"
"logfire-mcp","Logfire MCP Server","This repository contains a Model Context Protocol (MCP) server with tools that can access the OpenTelemetry traces and","https://github.com/pydantic/logfire-mcp","OpenTelemetry;traces;metrics;logging;monitoring","Dev Tools","{'name': 'pydantic'}","Local Servers"
"m2m-ssh-gateway","MCP SSH Gateway Client","A Model Context Protocol Server (Remote SSH client) that connects to remote MCP servers over SSH, proxying tools, prompts, and resources.","https://github.com/Machine-To-Machine/m2m-mcp-server-ssh-client.git","mcp;ssh;gateway;proxy;remote;client","Dev Tools","{'name': 'Machine To Machine'}","Local Servers"
"mac-messages-mcp","Mac Messages","An MCP server that securely interfaces with your iMessage database via the Model Context Protocol (MCP), allowing LLMs to query and analyze iMessage conversations. It includes robust phone number validation, attachment processing, contact management, group chat handling, and full support for sending and receiving messages.","https://github.com/carterlasalle/mac_messages_mcp","python;mac;messages","Messaging","{'name': 'carterlasalle'}","Local Servers"
"magic-mcp","21st.dev Magic AI Agent","Magic Component Platform (MCP) is a powerful AI-driven tool that helps developers create beautiful, modern UI components instantly through natural language descriptions. It integrates seamlessly with popular IDEs and provides a streamlined workflow for UI development.","https://github.com/21st-dev/magic-mcp","ui;components;ai;generator;react","Dev Tools","{'name': '21st-dev'}","Local Servers"
"mailgun","Mailgun MCP Server","A Model Context Protocol (MCP) server implementation for [Mailgun](https://mailgun.com), enabling MCP-compatible AI clients like Claude Desktop to interract with the service.","https://github.com/mailgun/mailgun-mcp-server","email;mailgun;mcp","Messaging","{'name': 'mailgun'}","Local Servers"
"make-mcp-server","Make MCP Server","A Model Context Protocol server that enables Make scenarios to be utilized as tools by AI assistants. This integration allows AI systems to trigger and interact with your Make automation workflows.","https://github.com/integromat/make-mcp-server","make;automation;ai;mcp;scenarios","Productivity","{'name': 'integromat'}","Local Servers"
"mariadb","MariaDB Database Integration","MariaDB database integration with configurable access controls in Python.","https://github.com/abel9851/mcp-server-mariadb","MariaDB;Data Retrieval","Databases","{'name': 'abel9851'}","Local Servers"
"markdownify","Markdownify","MCP to convert almost anything to Markdown (PPTX, HTML, PDF, Youtube Transcripts and more)","https://github.com/zcaceres/mcp-markdownify-server","markdown;conversion","Media Creation","{'name': 'zcaceres'}","Local Servers"
"markitdown","MarkItDown MCP Server","The `markitdown-mcp` package provides a lightweight STDIO and SSE MCP server for calling MarkItDown.","https://github.com/microsoft/markitdown/tree/main/packages/markitdown-mcp","markdown;conversion;server;AutoGen;document conversion","Media Creation","{'name': 'microsoft'}","Local Servers"
"materials-project","Materials Project","A MCP (Model Context Protocol) server that interacts with the Materials Project database, allowing for material search, structure visualization, and manipulation.","https://github.com/pathintegral-institute/mcp.science","materials;science","MCP Tools","{'name': 'pathintegral-institute'}","Local Servers"
"mathematica-check","Mathematica Check","A Model Context Protocol (MCP) server that allows MCP clients (like Cursor) to execute Mathematica code via wolframscript and verify mathematical derivations.","https://github.com/pathintegral-institute/mcp.science","mathematica","Professional Apps","{'name': 'LionSR'}","Local Servers"
"mcp-aiven","Aiven MCP Server","A [Model Context Protocol](https://modelcontextprotocol.io/) (MCP) server for Aiven.","https://github.com/Aiven-Open/mcp-aiven","PostgreSQL;Kafka;ClickHouse;Valkey;OpenSearch","Databases","{'name': 'Aiven-Open'}","Local Servers"
"mcp-alchemy","MCP Alchemy - Database Assistant","Database assistant MCP server enabling LLMs to interact with relational databases for exploration, querying, and analysis. Supports PostgreSQL, MySQL, MariaDB, SQLite, Oracle, MS SQL Server, CrateDB, Vertica, and other SQLAlchemy-compatible databases.","https://github.com/runekaagaard/mcp-alchemy","Database;SQL;PostgreSQL;MySQL;SQLite;Oracle;SQLAlchemy;Query Analysis","Databases","{'name': 'runekaagaard'}","Local Servers"
"mcp-audiense-insights","Audiense Insights","This server, based on the [Model Context Protocol (MCP)](https://github.com/modelcontextprotocol), allows **Claude** or any other MCP-compatible client to interact with your [Audiense Insights](https://www.audiense.com/) account. It extracts **marketing insights and audience analysis** from Audiense reports, covering **demographic, cultural, influencer, and content engagement analysis**.","https://github.com/AudienseCo/mcp-audiense-insights","marketing;audience analysis;insights;demographics;influencers","Analytics","{'name': 'AudienseCo'}","Local Servers"
"mcp-browser-use","Browser Use MCP Server","This project is an AI-driven browser automation server that implements the Model Context Protocol (MCP) for natural language control of web browsers and web research tasks.","https://github.com/Saik0s/mcp-browser-use","browser-automation;web-research;MCP;AI-driven;browser-control;web-scraping;natural-language;chrome;playwright","Web Services","{'name': 'Saik0s'}","Local Servers"
"mcp-circleci","CircleCI MCP Server","Model Context Protocol (MCP) is a [new, standardized protocol](https://modelcontextprotocol.io/introduction) for managing context between large language models (LLMs) and external systems. In this repository, we provide an MCP Server for [CircleCI](https://circleci.com).","https://github.com/CircleCI-Public/mcp-server-circleci","circleci;mcp;model context protocol;llm;ci/cd;build logs;flaky tests;config validation","Dev Tools","{'name': 'CircleCI-Public'}","Local Servers"
"mcp-clickhouse","ClickHouse MCP Server","An MCP server for ClickHouse.","https://github.com/ClickHouse/mcp-clickhouse","clickhouse;database;sql","Databases","{'name': 'ClickHouse'}","Local Servers"
"mcp-codex-keeper","Aindreyway MCP Codex Keeper","An intelligent MCP server that serves as a guardian of development knowledge, providing AI assistants with curated access to latest documentation and best practices.","https://github.com/aindreyway/mcp-codex-keeper","MCP;Server;documentation;knowledge base;AI;development;best practices","Knowledge Base","{'name': 'aindreyway'}","Local Servers"
"mcp-compass","Compass","Suggest the right MCP server for your needs","https://github.com/liuyoshio/mcp-compass","compass;service discovery","MCP Tools","{'name': 'liuyoshio'}","Local Servers"
"mcp-create","Create Server","A dynamic MCP server management service that creates, runs, and manages Model Context Protocol servers on-the-fly.","https://github.com/tesla0225/mcp-create","dynamic;TypeScript","MCP Tools","{'name': 'tesla0225'}","Local Servers"
"mcp-discord","MCP-Discord","A Discord MCP (Model Context Protocol) server that enables AI assistants to interact with the Discord platform.","https://github.com/barryyip0625/mcp-discord","discord;mcp;model context protocol;bot;messaging;webhook;channel management;forum","Messaging","{'name': 'barryyip0625'}","Local Servers"
"mcp-gitee","Gitee MCP Server","Gitee MCP Server is a Model Context Protocol (MCP) server implementation for Gitee. It provides a set of tools for interacting with Gitee's API, allowing AI assistants to manage repositories, issues, pull requests, and more.","https://github.com/oschina/mcp-gitee","gitee;mcp;repository;issues;pull requests","Dev Tools","{'name': 'oschina'}","Local Servers"
"mcp-grafana","Grafana MCP Server","A [Model Context Protocol][mcp] (MCP) server for Grafana.","https://github.com/grafana/mcp-grafana","grafana;mcp;model context protocol","Analytics","{'name': 'grafana'}","Local Servers"
"mcp-gsuite","MCP Google Workspace Integration","MCP server to interact with Google products.","https://github.com/MarkusPfundstein/mcp-gsuite","gmail;google;calendar;gsuite;google workspace;email;productivity","Productivity","{'name': 'MarkusPfundstein'}","Local Servers"
"mcp-installer","Installer","This server is a server that installs other MCP servers for you.","https://github.com/anaisbetts/mcp-installer","installer;server","MCP Tools","{'name': 'anaisbetts'}","Local Servers"
"mcp-jetbrains","JetBrains MCP Proxy Server","The server proxies requests from client to JetBrains IDE.","https://github.com/JetBrains/mcp-jetbrains","jetbrains;ide;proxy","Dev Tools","{'name': 'JetBrains'}","Local Servers"
"mcp-k8s-go","MCP K8S Go","MCP K8S Go is a Golang-based server that connects to Kubernetes, allowing users to interact with and manage Kubernetes resources using the Model Context Protocol (MCP).","https://github.com/strowk/mcp-k8s-go","kubernetes;mcp;golang;k8s;model context protocol;claude;tools","Dev Tools","{'name': 'strowk'}","Local Servers"
"mcp-local-rag","Local RAG","""primitive"" RAG-like web search model context protocol (MCP) server that runs locally using Google's MediaPipe Text Embedder and DuckDuckGo Search. ✨ no APIs required ✨.","https://github.com/nkapila6/mcp-local-rag","RAG;Search","Knowledge Base","{'name': 'nkapila6'}","Local Servers"
"mcp-mermaid","MCP Mermaid Server","Generate mermaid diagram and chart with AI MCP dynamically.","https://github.com/hustcc/mcp-mermaid","mermaid","Dev Tools","{'name': 'hustcc'}","Local Servers"
"mcp-neo4j-aura-api","Neo4j MCP (Aura API)","Neo4j graph database server (schema + read/write-cypher) and separate graph database backed memory","https://github.com/neo4j-contrib/mcp-neo4j","neo4j;mcp;knowledge graph;aura","Databases","{'name': 'neo4j-contrib'}","Local Servers"
"mcp-neo4j-memory","Neo4j MCP (Memory)","Neo4j graph database server (schema + read/write-cypher) and separate graph database backed memory","https://github.com/neo4j-contrib/mcp-neo4j","neo4j;mcp;knowledge graph","Databases","{'name': 'neo4j-contrib'}","Local Servers"
"mcp-neo4j","Neo4j MCP","This server enables running Cypher graph queries, analyzing complex domain data, and automatically generating business insights that can be enhanced with Claude's analysis when an Anthropic API key is provided.","https://github.com/neo4j-contrib/mcp-neo4j","neo4j;mcp;cypher;knowledge graph","Databases","{'name': 'neo4j-contrib'}","Local Servers"
"mcp-obsidian","MCP server for Obsidian","MCP server to interact with Obsidian via the Local REST API community plugin.","https://github.com/MarkusPfundstein/mcp-obsidian","obsidian;note-taking;knowledge-management;rest-api;mcp","Knowledge Base","{'name': 'MarkusPfundstein'}","Local Servers"
"mcp-oceanbase","OceanBase MCP Server","MCP Server for OceanBase database and its tools","https://github.com/oceanbase/mcp-oceanbase","database;OceanBase","Databases","{'name': 'oceanbase'}","Local Servers"
"mcp-playwright","Playwright","This MCP Server will help you run browser automation and webscraping using Playwright","https://github.com/executeautomation/mcp-playwright","Playwright;Browser Automation","Web Services","{'name': 'executeautomation'}","Local Servers"
"mcp-proxy","MCP Proxy","Connect to MCP servers that run on SSE transport, or expose stdio servers as an SSE server.","https://github.com/sparfenyuk/mcp-proxy","proxy;sse;stdio","MCP Tools","{'name': 'sparfenyuk'}","Local Servers"
"mcp-redis","Redis MCP Server","The Redis MCP Server is a natural language interface designed for AI applications to efficiently manage and search data in Redis, enabling AI-driven workflows to interact with structured and unstructured data using natural language queries.","https://github.com/redis/mcp-redis","redis;database;natural language interface;MCP;Model Content Protocol;data management;search;vector search;caching;streams;JSON","Databases","{'name': 'redis'}","Local Servers"
"mcp-run-python","MCP Run Python","The code is executed using [Pyodide](https://pyodide.org) in [Deno](https://deno.com/) and is therefore isolated from","https://github.com/pydantic/pydantic-ai/tree/main/mcp-run-python","python;sandbox;pyodide;deno;model context protocol;mcp;code execution","Dev Tools","{'name': 'pydantic'}","Local Servers"
"mcp-send-email","Email Sending MCP","This is a simple MCP server that sends emails using Resend's API. Why? Now you can let Cursor or Claude Desktop compose emails for you and send it right away without having to copy and paste the email content.","https://github.com/resend/mcp-send-email","email;resend;mcp;anthropic;cursor;claude","Messaging","{'name': 'resend'}","Local Servers"
"mcp-server-adfin","Adfin MCP Server","1. Python 3.10 or higher","https://github.com/Adfin-Engineering/mcp-server-adfin","adfin;finance;invoicing","Finance","{'name': 'Adfin-Engineering'}","Local Servers"
"mcp-server-axiom","Axiom MCP Server","A [Model Context Protocol](https://modelcontextprotocol.io/) server implementation for [Axiom](https://axiom.co) that enables AI agents to query your data using Axiom Processing Language (APL).","https://github.com/axiomhq/mcp-server-axiom","axiom;apl;data;query","Analytics","{'name': 'axiomhq'}","Local Servers"
"mcp-server-box","MCP Server Box","MCP Server Box is a Python project that integrates with the Box API to perform various operations such as file search, text extraction, AI-based querying, and data extraction. It leverages the `box-sdk-gen` library and provides a set of tools to interact with Box files and folders.","https://github.com/box-community/mcp-server-box","box;ai;file-management;search;text-extraction","Knowledge Base","{'name': 'box-community'}","Local Servers"
"mcp-server-browserbase","Browserbase MCP Server","Automate browser interactions in the cloud (e.g. web navigation, data extraction, form filling, and more)","https://github.com/browserbase/mcp-server-browserbase","browser automation;puppeteer;stagehand;web interaction;screenshots;javascript","Dev Tools","{'name': 'browserbase'}","Local Servers"
"mcp-server-cloudflare","Cloudflare MCP Server","Model Context Protocol (MCP) is a [new, standardized protocol](https://modelcontextprotocol.io/introduction) for managing context between large language models (LLMs) and external systems. In this repository, we provide an installer as well as an MCP Server for [Cloudflare's API](https://api.cloudflare.com).","https://github.com/cloudflare/mcp-server-cloudflare","cloudflare;mcp;model-context-protocol;llm;api","Dev Tools","{'name': 'cloudflare'}","Local Servers"
"mcp-server-esignatures","eSignatures MCP server","MCP server for eSignatures (https://esignatures.com)","https://github.com/esignaturescom/mcp-server-esignatures","contracts;templates;collaborators;esignatures","Productivity","{'name': 'esignaturescom'}","Local Servers"
"mcp-server-langfuse","Langfuse Prompt Management MCP Server","Open-source tool for collaborative editing, versioning, evaluating, and releasing prompts.","https://github.com/langfuse/mcp-server-langfuse","prompts;mcp;langfuse","Dev Tools","{'name': 'langfuse'}","Local Servers"
"mcp-server-milvus","MCP Server for Milvus","This repository contains a MCP server that provides access to Milvus vector database functionality.","https://github.com/zilliztech/mcp-server-milvus","milvus;vector database;mcp;model context protocol","Databases","{'name': 'zilliztech'}","Local Servers"
"mcp-server-motherduck","MotherDuck MCP Server","Query and analyze data with MotherDuck and local DuckDB","https://github.com/motherduckdb/mcp-server-motherduck","SQL;DuckDB;MotherDuck;analytics;database","Databases","{'name': 'motherduckdb'}","Local Servers"
"mcp-server-neon","Neon MCP Server","This lets you use Claude Desktop, or any MCP Client, to use natural language to accomplish things with Neon.","https://github.com/neondatabase/mcp-server-neon","database;postgres;neon;mcp;llm","Databases","{'name': 'neondatabase'}","Local Servers"
"mcp-server-qdrant","Qdrant MCP Server","This repository is an example of how to create a MCP server for Qdrant, a vector search engine.","https://github.com/qdrant/mcp-server-qdrant","vector-search;qdrant;memory;semantic-search","Databases","{'name': 'qdrant'}","Local Servers"
"mcp-server-raygun","Raygun MCP Server","MCP Server for Raygun's API V3 endpoints for interacting with your Crash Reporting and Real User Monitoring applications. This server provides comprehensive access to Raygun's API features through the Model Context Protocol.","https://github.com/MindscapeHQ/mcp-server-raygun","raygun;crash reporting;real user monitoring;error management;performance monitoring","Dev Tools","{'name': 'MindscapeHQ'}","Local Servers"
"mcp-server-singlestore","SingleStore MCP Server","Interact with the SingleStore database platform","https://github.com/singlestore-labs/mcp-server-singlestore","singlestore;database;sql;mcp;model context protocol","Databases","{'name': 'singlestore-labs'}","Local Servers"
"mcp-server-starrocks","StarRocks Official MCP Server","The StarRocks MCP Server acts as a bridge between AI assistants and StarRocks databases, allowing for direct SQL execution and database exploration without requiring complex setup or configuration.","https://github.com/StarRocks/mcp-server-starrocks","database;sql;starrocks","Databases","{'name': 'StarRocks'}","Local Servers"
"mcp-server-weibo","Weibo MCP Server","This is a server based on the [Model Context Protocol](https://modelcontextprotocol.io) for scraping Weibo user information, feeds, and search functionality. This server can help retrieve detailed information about Weibo users, feed content, and perform user searches.","https://github.com/Selenium39/mcp-server-weibo","weibo;social media;scraping;user information;search;TypeScript;MCP;Model Context Protocol","Web Services","{'name': 'Selenium39'}","Local Servers"
"mcp-server-weread","WeRead MCP Server","A WeChat reading MCP server that allows you to access WeChat reading notes and reading history in Claude Desktop.","https://github.com/freestylefly/mcp-server-weread","weread;wechat;reading;notes;claude;mcp;knowledge management;api","Knowledge Base","{'name': 'freestylefly'}","Local Servers"
"mcp-server","Integration App MCP Server","This is an implementation of the [Model Context Protocol (MCP) server](https://modelcontextprotocol.org/) that exposes tools powered by [Integration App](https://integration.app).","https://github.com/integration-app/mcp-server","integration;tools;mcp","MCP Tools","{'name': 'integration-app'}","Local Servers"
"mcp-tinybird","Tinybird MCP server","An MCP server to interact with a Tinybird Workspace from any MCP client.","https://github.com/tinybirdco/mcp-tinybird","tinybird;data;analytics","Analytics","{'name': 'tinybirdco'}","Local Servers"
"mcp-zenml","ZenML MCP Server","Interact with your MLOps and LLMOps pipelines through your ZenML MCP server","https://github.com/zenml-io/mcp-zenml","zenml;mcp;ai;ml;pipelines","Dev Tools","{'name': 'zenml-io'}","Local Servers"
"mcp","Semgrep MCP Server","An MCP server for using Semgrep to scan code for security vulnerabilies. Secure your vibe coding! ","https://github.com/semgrep/mcp","security;static analysis;code scanning;vulnerability detection","Dev Tools","{'name': 'semgrep'}","Local Servers"
"meilisearch-mcp","Meilisearch MCP Server","A Model Context Protocol (MCP) server for interacting with Meilisearch through LLM interfaces like Claude.","https://github.com/meilisearch/meilisearch-mcp","search;meilisearch;indexing;document management","Databases","{'name': 'meilisearch'}","Local Servers"
"mem0-mcp","Mem0 Server","A Model Context Protocol server for Mem0, which helps with managing coding preferences.","https://github.com/mem0ai/mem0-mcp","coding preferences;mem0","Dev Tools","{'name': 'mem0ai'}","Local Servers"
"memory-bank-mcp","Memory Bank MCP Server","The Memory Bank MCP Server is a Model Context Protocol (MCP) server implementation that provides remote access and management capabilities for memory bank files, enabling multi-project support, consistent file structure, and isolation between projects.","https://github.com/alioshr/memory-bank-mcp","memory bank;MCP;Model Context Protocol;remote memory;multi-project;Claude;Cline;Cursor","Knowledge Base","{'name': 'alioshr'}","Local Servers"
"memory","Knowledge Graph Memory","Knowledge graph-based persistent memory system","https://github.com/modelcontextprotocol/servers","knowledge graph;memory;persistent memory","Knowledge Base","{'name': 'modelcontextprotocol'}","Local Servers"
"metoro-mcp-server","Metoro MCP Server","This MCP Server allows you to interact with your Kubernetes cluster via the Claude Desktop App!","https://github.com/metoro-io/metoro-mcp-server","kubernetes;observability;eBPF;microservices","MCP Tools","{'name': 'metoro-io'}","Local Servers"
"microsoft-learn","Microsoft Learn MCP","Access Microsoft Learn documentation and resources through the Model Context Protocol. Provides comprehensive access to Microsoft's technical documentation, tutorials, and learning paths.","https://github.com/microsoft/microsoft-learn-mcp","microsoft;learn;documentation;azure;windows;dotnet;office;365;technical-docs","Documentation","{'name': 'Microsoft'}","Local Servers"
"mindmap","Mindmap","A server that generates mindmaps from input containing markdown code.","https://github.com/YuChenSSR/mindmap-mcp-server","mindmap;markdown;interactive","Media Creation","{'name': 'YuChenSSR'}","Local Servers"
"minima","Minima","MCP server for RAG on local files","https://github.com/dmayboroda/minima","ChatGPT;Integration;Local;Open Source","Knowledge Base","{'name': 'dmayboroda'}","Local Servers"
"minimax-mcp","MiniMax Model Context Protocol Server","Here is a concise description paragraph focused on what the MiniMax project does:

MiniMax is an official server that enables interaction with powerful text-to-speech, voice cloning, video generation, and image generation APIs through the MiniMax Model Context Protocol (MCP). It allows MCP clients like Claude Desktop, Cursor, Windsurf, and OpenAI Agents to generate speech, clone voices, create videos and images, and more.","https://github.com/MiniMax-AI/MiniMax-MCP","text-to-speech;voice-clone;video-generation;image-generation;MCP;API;Claude;Cursor;Windsurf","Media Creation","{'name': 'MiniMax-AI'}","Local Servers"
"mobile-mcp","Mobile MCP Server","This is a [Model Context Protocol (MCP) server](https://github.com/modelcontextprotocol) that enables scalable mobile automation, development through a platform-agnostic interface, eliminating the need for distinct iOS or Android knowledge. You can run it on emulators, simulators, and physical devices (iOS and Android).","https://github.com/mobile-next/mobile-mcp","mobile;automation;iOS;Android;simulator;emulator;physical devices;MCP;Model Context Protocol;accessibility;testing;LLM","Dev Tools","{'name': 'mobile-next'}","Local Servers"
"monday-com","Monday.com","MCP Server to interact with Monday.com boards and items.","https://github.com/sakce/mcp-server-monday","monday.com;API","Productivity","{'name': 'sakce'}","Local Servers"
