"slug","title","description","url","tags","category","author","source"
"duckduckgo-mcp","DuckDuckGo Search MCP Server","A Model Context Protocol (MCP) server that provides web search capabilities through DuckDuckGo, with additional features for content fetching and parsing.","https://github.com/nickclyde/duckduckgo-mcp-server","web search;duckduckgo;content fetching;rate limiting;mcp;text extraction","Web Services","{'name': 'nickclyde'}","Local Servers"
"dune-analytics-mcp","Dune Analytics","A mcp server that bridges Dune Analytics data to AI agents.","https://github.com/kukapay/dune-analytics-mcp","Dune;Analytics;AI agents","Finance","{'name': 'Kukapay'}","Local Servers"
"e2b-mcp-server","E2B MCP Server","This repository contains the source code for the [E2B](https://e2b.dev) MCP server.","https://github.com/e2b-dev/mcp-server","code-interpreter;claude;sandbox","MCP Tools","{'name': 'e2b-dev'}","Local Servers"
"edgeone-pages-mcp","EdgeOne Pages MCP","An MCP service for deploying HTML content to EdgeOne Pages and obtaining a publicly accessible URL.","https://github.com/TencentEdgeOne/edgeone-pages-mcp","html;deployment;edge functions;kv store;static content;serverless;mcp;tencent;edgeone","Web Services","{'name': 'TencentEdgeOne'}","Local Servers"
"edubase","EduBase MCP server","<img src=""https://static.edubase.net/media/brand/title/color.png"" alt=""EduBase logo"" height=""150"" />","https://github.com/EduBase/MCP","education;learning;quiz;assessment;API","MCP Tools","{'name': 'EduBase'}","Local Servers"
"elasticsearch","Elasticsearch","MCP server implementation that provides Elasticsearch interaction.","https://github.com/cr7258/elasticsearch-mcp-server","elasticsearch;server","Databases","{'name': 'cr7258'}","Local Servers"
"elevenlabs-mcp","ElevenLabs Official MCP Server","Text-to-speech and speech-to-text via ElevenLabs API.","https://github.com/elevenlabs/elevenlabs-mcp","ElevenLabs;text-to-speech;TTS;speech-to-text;STT;audio","Media Creation","{'name': 'elevenlabs'}","Local Servers"
"ergo-blockchain-mcp","Ergo Blockchain Explorer","-An MCP server to integrate Ergo Blockchain Node and Explorer APIs for checking address balances, analyzing transactions, viewing transaction history, performing forensic analysis of addresses, searching for tokens, and monitoring network status.","https://github.com/marctheshark3/ergo-mcp","Ergo;Blockchain;Python;API","Finance","{'name': 'marctheshark3'}","Local Servers"
"eunomia","Eunomia","Extension of the Eunomia framework that connects Eunomia instruments with MCP servers","https://github.com/whataboutyou-ai/eunomia-MCP-server","Eunomia;Data Governance","AI Systems","{'name': 'whataboutyou-ai'}","Local Servers"
"everart","EverArt","AI image generation using various models","https://github.com/modelcontextprotocol/servers","EverArt;API;Claude Desktop","Media Creation","{'name': 'modelcontextprotocol'}","Local Servers"
"everything-search","Everything Search","Fast file searching capabilities across Windows (using [Everything SDK](https://www.voidtools.com/support/everything/sdk/)), macOS (using mdfind command), and Linux (using locate/plocate command).","https://github.com/mamertofabian/mcp-everything-search","search;everything","System Tools","{'name': 'mamertofabian'}","Local Servers"
"everything","Everything","This MCP server exercises all the features of the MCP protocol. It is a test server for builders of MCP clients.","https://github.com/modelcontextprotocol/servers","testing;reference;example;demo","MCP Tools","{'name': 'MCP Team'}","Local Servers"
"evm-mcp-server","EVM Server","Comprehensive blockchain services for 30+ EVM networks, supporting native tokens, ERC20, NFTs, smart contracts, transactions, and ENS resolution.","https://github.com/mcpdotdirect/evm-mcp-server","Ethereum;Smart Contracts;AI;Token Transfers;NFTs","Finance","{'name': 'mcpdotdirect'}","Local Servers"
"exa-mcp-server","Exa MCP Server","A Model Context Protocol (MCP) server lets AI assistants like Claude use the Exa AI Search API for web searches. This setup allows AI models to get real-time web information in a safe and controlled way.","https://github.com/exa-labs/exa-mcp-server","search;web search;AI;Claude;MCP;Model Context Protocol","Web Services","{'name': 'exa-labs'}","Local Servers"
"excel","Excel","Excel manipulation including data reading/writing, worksheet management, formatting, charts, and pivot table.","https://github.com/haris-musa/excel-mcp-server","Excel Manipulation;Python","Productivity","{'name': 'haris-musa'}","Local Servers"
"f1-mcp-server","Formula One MCP Server","A Model Context Protocol (MCP) server that provides Formula One racing data.","https://github.com/Machine-To-Machine/f1-mcp-server.git","f1;formula one;racing;sports;data;mcp","Web Services","{'name': 'Machine To Machine'}","Local Servers"
"fantasy-pl","Fantasy Premier League","Give your coding agent direct access to up-to date Fantasy Premier League data","https://github.com/rishijatia/fantasy-pl-mcp","FPL;fantasy;football","Analytics","{'name': 'rishijatia'}","Local Servers"
"fastn-ai-unified-api-mcp-server","Fastn AI Unified API","A remote, dynamic MCP server with a unified API that connects to 1,000+ tools, actions, and workflows, featuring built-in authentication and monitoring.","https://github.com/fastnai/mcp-fastn","Fastn;Dynamic Tool Registration;API-Driven Operations","MCP Tools","{'name': 'fastnai'}","Local Servers"
"fetch-mcp","Fetch","A server that flexibly fetches HTML, JSON, Markdown, or plaintext.","https://github.com/zcaceres/fetch-mcp","fetch;web;api;html;json;markdown;plain text","Web Services","{'name': 'zcaceres'}","Local Servers"
"fetch","fetch","A Model Context Protocol server that provides web content fetching capabilities.","https://github.com/modelcontextprotocol/servers","Fetch;Server","Web Services","{'name': 'modelcontextprotocol'}","Local Servers"
"fetcher-mcp","Fetcher MCP","Fetcher MCP is a server for fetching web page content using the Playwright headless browser, capable of executing JavaScript and handling dynamic web content.","https://github.com/jae-jae/fetcher-mcp","web scraping;Playwright;headless browser;content extraction;JavaScript;Markdown;HTML;parallel processing;MCP server","Web Services","{'name': 'jae-jae'}","Local Servers"
"fewsats-mcp","Fewsats MCP Server","This MCP server integrates with [Fewsats](https://fewsats.com) and allows AI Agents to purchase anything in a secure way.","https://github.com/Fewsats/fewsats-mcp","payments;wallet;offers","Finance","{'name': 'Fewsats'}","Local Servers"
"fibery-mcp-server","Fibery MCP Server","This MCP (Model Context Protocol) server provides integration between Fibery and any LLM provider supporting the MCP protocol (e.g., Claude for Desktop), allowing you to interact with your Fibery workspace using natural language.","https://github.com/Fibery-inc/fibery-mcp-server","fibery;mcp;llm","Productivity","{'name': 'Fibery-inc'}","Local Servers"
"figma","Figma","Give your coding agent direct access to Figma file data, helping it one-shot design implementation.","https://github.com/GLips/Figma-Context-MCP","Figma;AI","Professional Apps","{'name': 'GLips'}","Local Servers"
"filesystem","Filesystem","Secure file operations with configurable access controls","https://github.com/modelcontextprotocol/servers","Node.js;server;filesystem;operations","System Tools","{'name': 'modelcontextprotocol'}","Local Servers"
"financial-datasets","Financial Datasets MCP Server","This is a Model Context Protocol (MCP) server that provides access to stock market data from [Financial Datasets](https://www.financialdatasets.ai/).","https://github.com/financial-datasets/mcp-server","finance;stock market;financial data","Finance","{'name': 'financial-datasets'}","Local Servers"
"fingertip","Fingertip","MCP server for Fingertip.com to search and create new sites.","https://github.com/fingertip-com/fingertip-mcp","Fingertip;AI Assistants","Web Services","{'name': 'fingertip-com'}","Local Servers"
"firebase","Firebase","Server to interact with Firebase services including Firebase Authentication, Firestore, and Firebase Storage.","https://github.com/gannonh/firebase-mcp","Firebase;LLM;Server","Databases","{'name': 'gannonh'}","Local Servers"
"firecrawl","Firecrawl","Advanced web scraping with JavaScript rendering, PDF support, and smart rate limiting","https://github.com/mendableai/firecrawl-mcp-server","firecrawl;scraping;web;api;automation","Web Services","{'name': 'mendableai'}","Local Servers"
"fireproof-mcp","Model Context Protocol and Fireproof Demo: JSON Document Server","Immutable ledger database with live synchronization","https://github.com/fireproof-storage/mcp-database-server","fireproof;database;MCP;Model Context Protocol;JSON;document store","Databases","{'name': 'fireproof-storage'}","Local Servers"
"flightradar24","Flightradar24","A Claude Desktop MCP server that helps you track flights in real-time using Flightradar24 data.","https://github.com/sunsetcoder/flightradar24-mcp-server","Flightradar24;Flight Tracking","Web Services","{'name': 'sunsetcoder'}","Local Servers"
"forevervm","ForeverVM MCP Server","data-color-mode=""auto"" data-light-theme=""light"" data-dark-theme=""dark""","https://github.com/jamsocket/forevervm","python;repl;claude","System Tools","{'name': 'jamsocket'}","Local Servers"
"ghidra-mcp","GhidraMCP","GhidraMCP is an Model Context Protocol server for allowing LLMs to autonomously reverse engineer applications. It exposes numerous tools from core Ghidra functionality to MCP clients.","https://github.com/LaurieWired/GhidraMCP","reverse engineering;Ghidra;MCP;binary analysis;decompiler;LLM;Model Context Protocol","Dev Tools","{'name': 'LaurieWired'}","Local Servers"
"ghost","Ghost","A Model Context Protocol (MCP) server for interacting with Ghost CMS through LLM interfaces like Claude.","https://github.com/MFYDev/ghost-mcp","Ghost;CMS;Admin API","Professional Apps","{'name': 'MFYDev'}","Local Servers"
"git-mcp","GitMCP","GitMCP is a free, open-source, remote Model Context Protocol (MCP) server that transforms any GitHub project into a documentation hub, enabling AI tools to access up-to-date documentation and code to eliminate code hallucinations.","https://github.com/idosal/git-mcp","MCP;GitHub;documentation;AI assistant;Model Context Protocol;code;open-source;no-hallucinations","Dev Tools","{'name': 'idosal'}","Local Servers"
"git","git","Tools to read, search, and manipulate Git repositories","https://github.com/modelcontextprotocol/servers","Git;Server;Automation","Dev Tools","{'name': 'modelcontextprotocol'}","Local Servers"
"github-actions","GitHub Actions","A Model Context Protocol (MCP) server for interacting with Github Actions.","https://github.com/ko1ynnky/github-actions-mcp-server","GitHub Actions;Workflow Management;Automation","Dev Tools","{'name': 'ko1ynnky'}","Local Servers"
"github","GitHub Official MCP Server","The official GitHub MCP server written in Go. Provides comprehensive GitHub API integration including repository management, issue tracking, pull requests, code search, and more.","https://github.com/github/github-mcp-server","github;code;repository;git;issues;pull-requests;api","Dev Tools","{'name': 'GitHub'}","Local Servers"
"gitlab","GitLab","GitLab API, enabling project management","https://github.com/modelcontextprotocol/servers","GitLab;API","Dev Tools","{'name': 'modelcontextprotocol'}","Local Servers"
"glean","Glean","A server that uses Glean API to search and chat.","https://github.com/longyi1207/glean-mcp-server","glean;search;chat;docker","Knowledge Base","{'name': 'longyi1207', 'url': 'https://github.com/longyi1207'}","Local Servers"
"gmail-headless","Headless Gmail Server","Remote hostable MCP server that can get and send Gmail messages without local credential or file system setup.","https://github.com/baryhuang/mcp-headless-gmail","Gmail;Headless;Docker;API","Messaging","{'name': 'baryhuang'}","Local Servers"
"gmail","Gmail AutoAuth","A Model Context Protocol (MCP) server for Gmail integration in Claude Desktop with auto authentication support.","https://github.com/GongRzhe/Gmail-MCP-Server","gmail;autoauth;claude","Messaging","{'name': 'GongRzhe'}","Local Servers"
"goal-story","Goal Story","a Goal Tracker and Visualization Tool for personal and professional development.","https://github.com/hichana/goalstory-mcp","goal tracking;storytelling;AI","Productivity","{'name': 'hichana'}","Local Servers"
"godot","Godot","A MCP server providing comprehensive Godot engine integration for project editing, debugging, and scene management.","https://github.com/Coding-Solo/godot-mcp","Godot;AI;Game","Media Creation","{'name': 'Coding Solo', 'url': 'https://github.com/Coding-Solo'}","Local Servers"
"goodnews","Goodnews","A simple MCP server that delivers curated positive and uplifting news stories.","https://github.com/VectorInstitute/mcp-goodnews","positive news;uplifting;Cohere;NewsAPI","Web Services","{'name': 'VectorInstitute'}","Local Servers"
"google-calendar","Google Calendar","Google Calendar MCP Server for managing Google calendar events. Also supports searching for events by attributes like title and location.","https://github.com/nspady/google-calendar-mcp","Google Calendar;event management","Productivity","{'name': 'nspady'}","Local Servers"
"google-custom-search","Google Custom Search","Provides Google Search results via the Google Custom Search API","https://github.com/adenot/mcp-google-search","Google;Custom Search;Webpage Reading","Web Services","{'name': 'adenot'}","Local Servers"
"google-drive","Google Drive","File access and search capabilities for Google Drive","https://github.com/modelcontextprotocol/servers","google drive;files;API","Productivity","{'name': 'modelcontextprotocol'}","Local Servers"
"google-maps","Google Maps","Location services, directions, and place details","https://github.com/modelcontextprotocol/servers","Google Maps;Geolocation","Web Services","{'name': 'modelcontextprotocol'}","Local Servers"
"google-tasks","Google Tasks","Google Tasks API Model Context Protocol Server.","https://github.com/zcaceres/gtasks-mcp","google;tasks;productivity","Productivity","{'name': 'zcaceres'}","Local Servers"
"gotohuman-mcp-server","gotoHuman MCP Server","Let your **AI agents ask for human reviews** in gotoHuman via MCP.","https://github.com/gotohuman/gotohuman-mcp-server","human review;AI agents;webhook;automation","AI Systems","{'name': 'gotohuman'}","Local Servers"
"gpaw-computation","GPAW Computation Server","MCP server for running GPAW (Grid-based Projector Augmented Wave) computational calculations for materials science and quantum mechanics simulations.","https://github.com/pathintegral-institute/mcp.science","quantum;computation","AI Systems","{'name': 'Path Integral Institute', 'email': 'info@pathintegral.xyz'}","Local Servers"
"graphlit-mcp-server","Graphlit MCP Server","The Model Context Protocol (MCP) Server enables integration between MCP clients and the Graphlit service. This document outlines the setup process and provides a basic example of using the client.","https://github.com/graphlit/graphlit-mcp-server","mcp;graphlit;retrieval;extraction;ingestion;web;notifications","Knowledge Base","{'name': 'graphlit'}","Local Servers"
"graphql-schema","GraphQL Schema Model Context Protocol","Allow LLMs to explore large GraphQL schemas without bloating the context.","https://github.com/hannesj/mcp-graphql-schema","GraphQL;LLMs;Schema;API","Dev Tools","{'name': 'hannesj'}","Local Servers"
"greptimedb-mcp-server","GreptimeDB MCP Server","A Model Context Protocol (MCP) server implementation for [GreptimeDB](https://github.com/GreptimeTeam/greptimedb).","https://github.com/GreptimeTeam/greptimedb-mcp-server","database;sql;greptimedb;mcp","Databases","{'name': 'GreptimeTeam'}","Local Servers"
"greptimedb","GreptimeDB","<source media=""(prefers-color-scheme: light)"" srcset=""https://cdn.jsdelivr.net/gh/GreptimeTeam/greptimedb@main/docs/logo-text-padding.png"">","https://github.com/GreptimeTeam/greptimedb","database;timeseries;observability;metrics;logs;events","Databases","{'name': 'GreptimeTeam'}","Local Servers"
"gyazo","Gyazo MCP Server","A Model Context Protocol server for Gyazo image integration","https://github.com/nota/gyazo-mcp-server","gyazo;images;mcp;model context protocol;typescript;api;search;upload;ocr","Media Creation","{'name': 'nota'}","Local Servers"
"hdw-linkedin","HDW","Access to profile data and management of user account with [HorizonDataWave.ai](https://horizondatawave.ai/).","https://github.com/horizondatawave/hdw-mcp-server","LinkedIn;API access;Data retrieval;User management","Productivity","{'name': 'horizondatawave'}","Local Servers"
"heroku","Heroku Platform MCP Server","The Heroku Platform MCP Server is a specialized Model Context Protocol (MCP) implementation designed to facilitate","https://github.com/heroku/heroku-mcp-server","heroku;mcp;platform;llm;model context protocol;devops;cloud;deployment;postgresql;database","Dev Tools","{'name': 'heroku'}","Local Servers"
"heurist-mesh-agent","Mesh Agent","Access specialized web3 AI agents for blockchain analysis, smart contract security, token metrics, and blockchain interactions through the [Heurist Mesh network](https://github.com/heurist-network/heurist-agent-framework/tree/main/mesh).","https://github.com/heurist-network/heurist-mesh-mcp-server","Heurist;Agent Framework;Blockchain Tools","Finance","{'name': 'Heurist Network'}","Local Servers"
"holaspirit","Holaspirit","Interact with [Holaspirit](https://www.holaspirit.com/).","https://github.com/syucream/holaspirit-mcp-server","Holaspirit;AI","Productivity","{'name': 'syucream'}","Local Servers"
"home-assistant","Hass","Docker-ready MCP server for Home Assistant with entity management, domain summaries, automation support, and guided conversations. Includes pre-built container images for easy installation.","https://github.com/voska/hass-mcp","Home Assistant;Claude;LLM;Automation","System Tools","{'name': 'voska'}","Local Servers"
"hubspot","HubSpot CRM Integration","HubSpot CRM integration for managing contacts and companies. Create and retrieve CRM data directly through Claude chat.","https://github.com/buryhuang/mcp-hubspot","HubSpot;API;AI;CRM;Integration","Productivity","{'name': 'buryhuang'}","Local Servers"
"huggingface-spaces","HuggingFace Spaces 🤗","Server for using HuggingFace Spaces, supporting Open Source Image, Audio, Text Models and more. Claude Desktop mode for easy integration.","https://github.com/evalstate/mcp-hfspace","Hugging Face;Claude Desktop","AI Systems","{'name': 'evalstate'}","Local Servers"
"hyperbrowser","Hyperbrowser MCP Server","This is Hyperbrowser's Model Context Protocol (MCP) Server. It provides various tools to scrape, extract structured data, and crawl webpages. It also provides easy access to general purpose browser agents like OpenAI's CUA, Anthropic's Claude Computer Use, and Browser Use.","https://github.com/hyperbrowserai/mcp","browser;web;scraping;crawling;automation","Web Services","{'name': 'hyperbrowserai'}","Local Servers"
"hyperliquid","Hyperliquid","An MCP server implementation that integrates the Hyperliquid SDK for exchange data.","https://github.com/mektigboy/server-hyperliquid","Hyperliquid;Exchange","Finance","{'name': 'mektigboy'}","Local Servers"
"ida-mcp","IDA MCP Server","A Model Context Protocol server for IDA interaction and automation. This server provides tools to read IDA database via Large Language Models.","https://github.com/MxIris-Reverse-Engineering/ida-mcp-server","IDA;reverse engineering;MCP;Model Context Protocol;automation;LLM;IDA Pro","Dev Tools","{'name': 'MxIris-Reverse-Engineering'}","Local Servers"
"image-generation","Image Generation","This MCP server provides image generation capabilities using the Replicate Flux model.","https://github.com/GongRzhe/Image-Generation-MCP-Server","image;generation;flux;Replicate","Media Creation","{'name': 'GongRzhe'}","Local Servers"
"inbox-zero","Inbox Zero MCP Server","data-color-mode=""auto"" data-light-theme=""light"" data-dark-theme=""dark""","https://github.com/elie222/inbox-zero","email;inbox;assistant;mcp","Messaging","{'name': 'elie222'}","Local Servers"
"influxdb","InfluxDB","Run queries against InfluxDB OSS API v2.","https://github.com/idoru/influxdb-mcp-server","InfluxDB;API;server;time-series","Databases","{'name': 'idoru'}","Local Servers"
"inkeep","Inkeep MCP Server","Inkeep MCP Server powered by your docs and product content.","https://github.com/inkeep/mcp-server-python","rag;documentation;product content","Knowledge Base","{'name': 'inkeep'}","Local Servers"
"inoyu","Inoyu Apache Unomi","Interact with an Apache Unomi CDP customer data platform to retrieve and update customer profiles","https://github.com/sergehuber/inoyu-mcp-unomi-server","Apache Unomi;User Profiles;Context Management","Databases","{'name': 'sergehuber'}","Local Servers"
"intercom","Intercom Support Server","An MCP-compliant server for retrieving customer support tickets from Intercom. This tool enables AI assistants like Claude Desktop and Cline to access and analyze your Intercom support tickets.","https://github.com/raoulbia-ai/mcp-server-for-intercom","Intercom;support-tickets;API","Messaging","{'name': 'raoulbia-ai'}","Local Servers"
"ios-simulator-mcp","iOS Simulator MCP Server","A Model Context Protocol (MCP) server for interacting with iOS simulators. This server allows you to interact with iOS simulators by getting information about them, controlling UI interactions, and inspecting UI elements.","https://github.com/joshuayoes/ios-simulator-mcp","iOS;simulator;MCP;testing;QA;UI interaction;automation","Dev Tools","{'name': 'joshuayoes'}","Local Servers"
"iterm-mcp","iTerm","Integration with iTerm2 terminal emulator for macOS, enabling LLMs to execute and monitor terminal commands.","https://github.com/ferrislucas/iterm-mcp","iTerm;server;automation","System Tools","{'name': 'ferrislucas'}","Local Servers"
"jinni","Jinni: Bring Your Project Into Context","<a href=""https://glama.ai/mcp/servers/@smat-dev/jinni"">","https://github.com/smat-dev/jinni","context;project;LLM;MCP;development;code;file management;context window","Media Creation","{'name': 'smat-dev'}","Local Servers"
"john-zhang-dev-xero-mcp-server","Xero","Enabling clients to interact with Xero system for streamlined accounting, invoicing, and business operations.","https://github.com/john-zhang-dev/xero-mcp","","Finance","{'name': 'john-zhang-dev'}","Local Servers"
"json","JSON Model Context Protocol","JSON handling and processing server with advanced query capabilities using JSONPath syntax and support for array, string, numeric, and date operations.","https://github.com/GongRzhe/JSON-MCP-Server","json;data querying;standardized tools","Dev Tools","{'name': 'GongRzhe'}","Local Servers"
"jupyter-mcp","Jupyter MCP Server","Jupyter MCP Server is a [Model Context Protocol](https://modelcontextprotocol.io) (MCP) server implementation that provides interaction with 📓 Jupyter notebooks running in any JupyterLab (works also with your 💻 local JupyterLab).","https://github.com/datalayer/jupyter-mcp-server","jupyter;mcp;model context protocol;notebook;jupyterlab;claude","Dev Tools","{'name': 'datalayer'}","Local Servers"
"kagimcp","Kagi MCP server","<a href=""https://glama.ai/mcp/servers/xabrrs4bka"">","https://github.com/kagisearch/kagimcp","search;summarizer","Analytics","{'name': 'kagisearch'}","Local Servers"
"keboola-mcp-server","Keboola MCP Server","<a href=""https://glama.ai/mcp/servers/72mwt1x862""><img width=""380"" height=""200"" src=""https://glama.ai/mcp/servers/72mwt1x862/badge"" alt=""Keboola Explorer Server MCP server"" /></a>","https://github.com/keboola/keboola-mcp-server","keboola;data;storage;snowflake","Analytics","{'name': 'keboola'}","Local Servers"
"keycloak-mcp","Keycloak Model Context Protocol","This MCP server enables natural language interaction with Keycloak for user and realm management including creating, deleting, and listing users and realms.","https://github.com/ChristophEnglisch/keycloak-model-context-protocol","Keycloak;User Management;Realm Management","System Tools","{'name': 'ChristophEnglisch'}","Local Servers"
"kibela","Kibela","Interact with Kibela API.","https://github.com/kiwamizamurai/mcp-kibela-server","Kibela;Integration","Knowledge Base","{'name': 'kiwamizamurai'}","Local Servers"
"kubectl-mcp","Kubectl MCP Server","A Model Context Protocol (MCP) server for Kubernetes that enables AI assistants like Claude, Cursor, and others to interact with Kubernetes clusters through natural language.","https://github.com/rohitg00/kubectl-mcp-server","kubernetes;kubectl;MCP;Model Context Protocol;AI assistants;CLI;Python;k8s","Dev Tools","{'name': 'rohitg00'}","Local Servers"
"kubernetes-and-openshift","Kubernetes and OpenShift","A powerful Kubernetes MCP server with additional support for OpenShift. Besides providing CRUD operations for any Kubernetes resource, this server provides specialized tools to interact with your cluster.","https://github.com/manusa/kubernetes-mcp-server","Kubernetes;Server","Dev Tools","{'name': 'manusa'}","Local Servers"
"kubernetes","Kubernetes","Connect to Kubernetes cluster and manage pods, deployments, and services.","https://github.com/Flux159/mcp-server-kubernetes","kubernetes;server;management","Dev Tools","{'name': 'Flux159'}","Local Servers"
"langflow-doc-qa-server","Langflow Document Q&A","A Model Context Protocol server for document Q&A powered by Langflow. It demonstrates core MCP concepts by providing a simple interface to query documents through a Langflow backend.","https://github.com/GongRzhe/Langflow-DOC-QA-SERVER","Langflow;Document Q&A","Knowledge Base","{'name': 'GongRzhe'}","Local Servers"
